Year,Police Service,City,Province,Civilian Consequences,Investigation Final Decision,Link
2020,OPP,Muskoka,Ontario,n r\n The following scenario emerges from the weight of the evidence collected by the SIU which included interviews with the Complainant SO 1 and several witness officers and civilians who were present at points during the Complainant’s period of custody As was his right SO 2 chose not to interview with the SIU or authorize the release of his notes At about 1:40 a.m on August 1 2020 the OPP received a 911 call from CW 1 an employee at the South Muskoka Memorial Hospital CW 1 indicated that two inebriated men had just left the emergency department and one of them had broken a gate in the parking lot Officers were dispatched to investigate The Complainant was responsible for the property damage In the company of his friend CW 2 the Complainant had gone to the hospital in a cab to have his left arm checked out He and CW 2 had been at a house party the evening before where they drank to excess In the course of the festivities the Complainant had fallen from a deck and begun to feel pain in his left arm and side The Complainant was loud and belligerent at the hospital At one point while still being triaged and concerned about being infected with the coronavirus the Complainant up and left the hospital with his friend in tow SO 1 and SO 2 arrived in the area of the hospital in a marked SUV and located the Complainant and CW 2 walking along Ann Street The Complainant was limping and clutching his left arm He greeted the officers with the same belligerence he had displayed at the hospital With the arrival of other officers CW 2 was placed into a cruiser and offered a ride home while the Complainant agreed to be returned to hospital to be examined The Complainant was placed in the back seat of SO 1’s cruiser where he sat peacefully but only for a while His ire returned and he started striking the divider cage inside the cruiser SO 1 opened the rear door and advised the Complainant that he was under arrest for public intoxication The Complainant tried to exit the cruiser and at one point punched SO 1 in the right eye With his right forearm across the Complainant’s chest SO 1 used his weight to keep the Complainant in the cruiser and reacted to the punch by delivering a punch of his own to the Complainant’s face with his left hand With the help of WO 1 and SO 2 the officers were able to reinsert the Complainant’s legs into the cruiser and close the doors SO 1 and SO 2 drove the Complainant back to the hospital and parked in front of the emergency doors They were accompanied by the other officers who were present when the Complainant was picked up The Complainant’s combativeness remained unabated As SO 1 opened the rear driver’s side door the Complainant immediately flailed his arms and legs at the officer striking him several times SO 1 punched the Complainant twice to the face after which the officer grabbed hold of the Complainant and forcibly removed him from the cruiser The Complainant was placed face first on the ground He continued to resist as the officers attempted to handcuff him and was struck with an additional punch by SO 1 and one or two strikes to the torso by SO 2 Following the punches the Complainant’s hands were handcuffed behind his back and he was escorted into the hospital.\n,Accordingly there is no basis for proceeding with criminal charges in this case and the file is closed,https://www.siu.on.ca/en/directors_report_details.php?drid=1154
2020,OPP,,Ontario,The Complainant was subsequently diagnosed with severe injuries including multiple rib fractures and facial fractures,Accordingly there is no basis for proceeding with charges in this case and the file is closed,https://www.siu.on.ca/en/directors_report_details.php?drid=1158
2020,London Police Service,London,Ontario,The Complainant was transported by ambulance to the UH in London where she was diagnosed with a fracture to the radial bone in one of her arms,Accordingly there is no basis for proceeding with charges in this case and the file is closed,https://www.siu.on.ca/en/directors_report_details.php?drid=933
2020,Waterloo Regional Police Service,,Ontario,The Complainant was seen at hospital and eventually diagnosed with a fractured foot,Accordingly there is no basis for proceeding with criminal charges in this case and the file is closed,https://www.siu.on.ca/en/directors_report_details.php?drid=1075
2020,OPP,Lakeshore,Ontario,At hospital following his apprehension the Complainant was diagnosed with a dog bite and several fractured right-sided ribs,Accordingly there is no basis for proceeding with criminal charges in this case and the file is closed,https://www.siu.on.ca/en/directors_report_details.php?drid=1069
2020,Toronto Police Service,Simcoe,Ontario,The Complainant was placed in the ambulance and rushed to hospital where he was treated for a massive cocaine overdose,In the final analysis as there is every indication in the evidence that the officers responsible for the Complainant’s care acquitted themselves professionally throughout his period of custody there is no basis for proceeding with criminal charges in this case,https://www.siu.on.ca/en/directors_report_details.php?drid=1089
2020,Brockville Police Service,Augusta,Ontario,Ayala-Guerrero’s death to “multiple blunt force injures”,Ayala-Guerrero there is no basis for criminal charges in this case and the file is closed,https://www.siu.on.ca/en/directors_report_details.php?drid=1132
2020,Toronto Police Service,Kingston,Ontario,Paramedics arrived at the scene and took the Complainant to hospital where he was diagnosed with several facial fractures and fractures of the right leg,Accordingly there is no basis for proceeding with criminal charges in this case and the file is closed,https://www.siu.on.ca/en/directors_report_details.php?drid=1059
2020,York Regional Police,,Ontario,xa0 r\n\xa0 nCause of Death nThe preliminary cause of death was determined to be “Blunt force injuries,In the result as I am satisfied on the aforementioned-record that the SO comported himself at all times within the law in the course of a very brief pursuit of the Honda there is no basis for proceeding with criminal charges against the officer,https://www.siu.on.ca/en/directors_report_details.php?drid=1081
2020,OPP,,Ontario,He was subsequently taken for x-rays and diagnosed with a break of one of his lower forearms,On my assessment of the evidence there are no reasonable grounds to believe that the SO committed a criminal offence in connection with the Complainant’s apprehension and injury,https://www.siu.on.ca/en/directors_report_details.php?drid=931
2020,Kingston Police,Kingston,Ontario,n r\n The material events in question are apparent on the evidence collected by the SIU which included interviews with the Complainant the WO and other officers responsible for the Complainant’s health and safety while in custody The investigation also benefitted from a video recording that captured the Complainant’s entire time in police cells at KP headquarters At about 11:38 a.m on July 19 2020 the Complainant was lodged in a cell at KP police headquarters She had earlier been arrested by OPP officers in Picton in relation to her involvement in a carjacking and theft of a canoe in Kingston that morning KP officers took custody of the Complainant from the OPP and returned her to Kingston The Complainant’s time in the police cell was largely uneventful This changed at about 6:49 p.m at which time the Complainant removed a baggie of drugs from her vagina Starting at about 7:00 p.m the Complainant began to consume the drugs The first signs of the Complainant’s health being impacted by the drugs started at about 7:17 p.m at which time she appeared unsteady on her feet and started to mumble At 7:29 p.m the Complainant’s hands started to shake and she became very jittery When asked by a cell monitor at 7:41 p.m whether she was okay the Complainant replied that she was not That was followed shortly by the Complainant’s responding in the affirmative when asked if she had “taken something” An ambulance was summoned to the station and the Complainant escorted out of the cell into the booking area Paramedics arrived at about 7:54 p.m The Complainant was placed on a stretcher and taken to hospital.\n,Accordingly there is no basis for proceeding with criminal charges in this case and the file is closed,https://www.siu.on.ca/en/directors_report_details.php?drid=1071
2020,Brantford Police Service,,Ontario,He had suffered serious head injuries and a pulmonary contusion,On the aforementioned-record as there is insufficient evidence to conclude that the SO failed to conduct himself with due care and regard for the Complainant’s safety in the context of a very brief engagement lasting not much longer than a minute there is no basis for proceeding with criminal charges against the officer,https://www.siu.on.ca/en/directors_report_details.php?drid=1124
2020,Peel Regional Police,Mississauga,Ontario,Following his arrest the Complainant was loaded onto a stretcher without further incident and taken to hospital where he was diagnosed with serious injuries including a fracture of the fibular head,Accordingly there is no basis for proceeding with criminal charges against the officer and the file is closed,https://www.siu.on.ca/en/directors_report_details.php?drid=1057
2020,Toronto Police Service,Kingston,Ontario,The SO did not sustain any serious injury in the collision,On my assessment of the evidence there are no reasonable grounds to believe that the SO committed a criminal offence in connection with the motor vehicle collision,https://www.siu.on.ca/en/directors_report_details.php?drid=972
2020,OPP,Armour,Ontario,Hegedus’ death to “[g]unshot wound of right back”,Accordingly there is no basis for proceeding with criminal charges in this case and the file is closed,https://www.siu.on.ca/en/directors_report_details.php?drid=1392
2020,Sault Ste. Marie Police Service,,Ontario,The investigation also benefitted from a video recording from a hospital camera which captured the incident resulting in the Complainant’s injury,Accordingly there is no basis for proceeding with criminal charges in this case,https://www.siu.on.ca/en/directors_report_details.php?drid=958
2020,Stratford Police Service,,Ontario,He was treated at hospital released back into the custody of the police and returned to the police station,Accordingly there is no basis for proceeding with criminal charges in this case and the file is closed,https://www.siu.on.ca/en/directors_report_details.php?drid=1043
2020,Hamilton Police Service,Ottawa,Ontario,r\n\nCause of Death nThe pathologist at autopsy attributed the Complainant’s death to a “gunshot wound of the back of the head”,In the result as I am satisfied on reasonable grounds that SO 1 and SO 2 acted lawfully throughout their interaction with the Complainant there is no basis for proceeding with criminal charges in this case,https://www.siu.on.ca/en/directors_report_details.php?drid=1166
2020,Waterloo Regional Police Service,Waterloo,Ontario,Information was provided to paramedics that CW 2’s injuries were the result of a fall down stairs,Be that as it may as I am satisfied that there is insufficient evidence to reasonably believe the officers acted other than lawfully during the encounter in question there is no basis for proceeding with criminal charges,https://www.siu.on.ca/en/directors_report_details.php?drid=1105
2020,Halton Regional Police Service,Milton,Ontario,The Complainant was taken to hospital where she was diagnosed with a fractured left pelvis and left humerus,Accordingly there is no basis for proceeding with criminal charges,https://www.siu.on.ca/en/directors_report_details.php?drid=1122
2020,Peel Regional Police,Brampton,Ontario,He was taken to hospital from the scene where he was diagnosed with a fractured ankle,Accordingly there is no basis for proceeding with criminal charges in this case and the file is closed,https://www.siu.on.ca/en/directors_report_details.php?drid=1037
2020,Peel Regional Police,Brampton,Ontario,n r\n The following scenario emerges on the evidence collected by the SIU which included interviews with the Complainant and the SO as well as a number of other officers and civilian witnesses who observed parts of the events in question The investigation also benefitted significantly by video recordings from a police helicopter and a commercial premises that captured the incident In the evening of June 30 2020 a team of PRP tactical officers led by the SO was asked by PRP robbery investigators to assist in the arrest of persons suspected of committing a series of violent carjackings There had been a spike of these crimes in recent weeks in Peel Region and the Greater Toronto Area often times targeting Range Rovers Typically the suspects would stage a minor collision with the vehicle whereupon they would accost the driver after he or she exited the vehicle brandishing a gun or knife beat them if there was any resistance and drive off with the vehicle By June 30 2020 a number of vehicles used by the perpetrators of these crimes including a black Ford Mustang as well as several suspects had been identified by PRP robbery investigators The Complainant was among the suspects Earlier in the day PRP robbery investigators had received word from York Regional Police officers with whom they were collaborating on the carjacking investigation of one such incident in Markham Two men had approached a black Range Rover pistol whipped the owner in the head and drove off in his vehicle The Ford Mustang was involved in the robbery Several hours later PRP learned from the Halton Regional Police Service that the same Ford Mustang had followed a woman in her white Range Rover to her residence in Oakville As the driver pulled into her garage a male exited the Mustang ran up to the Range Rover and attempted to open the door The driver reversed out of the garage and the male fled the scene in the Mustang The male was the Complainant Finally about an hour later PRP investigators were informed that the Mustang had been seen striking the rear of a red Range Rover The female driver asked the driver of the Mustang – the Complainant – to follow her home to discuss the damage He did so However arriving at the woman’s address to find her husband at the bottom of the driveway inspecting the damage to the car the Complainant fled the area By the time of the last attempted carjacking PRP robbery investigators together with the SO and his team of officers were in their vehicles monitoring the movements of the Ford Mustang which had been seen to enter the City of Brampton At one point the Complainant stopped to let out a passenger in the rear seat before he made his way onto Torbram Road and travelled north As he approached Williams Parkway the Complainant turned into the Petro Canada gas station at the southeast corner of the intersection and stopped his vehicle at the northern most gas pump just west of the cashier’s kiosk The SO was the passenger in a Ford Expedition SUV being driven by WO 7 The officer conferred with the lead PRP detective in charge of their robbery investigation and decided they would attempt to stop the vehicle and arrest its occupants at this time He called the takedown signal The time was about 7:45 p.m The Ford Expedition entered the gas station lot from Torbram Road travelled around the east side of the cashier’s kiosk and drove up to the front passenger side of the Mustang bumping it as it came to a stop The SO exited through the Expedition’s passenger door gun in hand and pointed at the Mustang just as a Ford F350 pickup truck with WO 1 and WO 8 aboard pulled up and stopped front first at a 90-degree angle with the Mustang in front of the driver’s front corner of the vehicle At the sight of the SO and the vehicles surrounding his Mustang the Complainant accelerated in reverse trying to evade the blockade The Mustang did not get very far though as it struck the rear of a civilian SUV which had stopped for gas at the southern pump At about the same time the SO was making his way across the front of the Mustang handgun still pointed at the Complainant and yelling out at the driver to stop the vehicle The officer had noticed another civilian vehicle on the opposite side of the gas pump and was headed in that direction concerned that the Complainant might attempt to steal it to make good his escape After striking the vehicle behind him the Complainant accelerated and travelled forward in a northwest direction toward the SO As the officer moved to his right to avoid the vehicle he discharged his firearm three times in quick succession at the direction of the Complainant The final shot occurred around the time that the Complainant’s vehicle made contact with the SO and sent him to the ground The Ford F350 moved up a short distance and collided with the Mustang’s front end With the Mustang now at a standstill WO 1 exiting the passenger door of the F350 with a C8 rifle in hand and WO 6 the latter a dog handler who was part of the operation and had driven into the gas station lot bringing his vehicle to a stop south of the cashier kiosk approached the driver’s door and ordered the Complainant out of the vehicle When the Complainant failed to do so and instead continued to rev his engine WO 6 lifted his police dog and placed him inside the vehicle through the shattered driver’s door window The dog bit into the Complainant’s left upper arm  shoulder area and held on Shortly thereafter WO 6 discharged his CEW at the Complainant as did WO 1 This was followed by two punches to the Complainant head by WO 6 after which the officers extricated the Complainant from the Mustang and placed him on the ground The dog still with a hold of the Complainant as he exited the Mustang was released by WO 6 The Complainant was subsequently handcuffed As the Complainant’s was being arrested so too was his front seat passenger CW 1 CW 1 was removed from the Mustang by WO 7 and WO 8 Once CW 1 was on the ground and handcuffed WO 8 noticed a gun next to the front passenger seat of the Mustang Upon examination it was learned that the gun was an air pistol The three shots fired by the SO struck the Mustang One of them struck the driver’s side hood of the vehicle another struck the driver’s side lower corner of the windshield and the final shot impacted the driver’s door slightly below its top edge Only one of the bullets fired by the SO struck the Complainant The projectile entered the Complainant’s right arm n,In the result as I am satisfied for the foregoing reasons that the SO and the other officers who participated in the operation that resulted in the Complainant’s arrest conducted themselves lawfully throughout the incident there is no basis for proceeding with criminal charges in this case,https://www.siu.on.ca/en/directors_report_details.php?drid=1138
2020,Barrie Police Service,,Ontario,n r\n While there is discrepancy in the accounts of the witnesses interviewed by the SIU which included those of the Complainant the SO and a couple of civilian eyewitnesses there is sufficient clarity in the evidence to resolve the criminal liability issues In the afternoon of June 29 2020 officers were dispatched to a domestic disturbance call at an address on Courtney Crescent A neighbour had called the police upon hearing a female crying from the home saying that she needed to go to the hospital and accusing a male of hurting her and a male replying that “[I can’t.” From a second-floor balcony at the rear of the house the Complainant jumped to the ground below and made his way to a wire mesh fence that separated the house on Courtney Crescent from the neighbouring property to the east The SO was the first officer at the scene He was immediately directed to the rear of the property by a paramedic – CW 2 – who had preceded his arrival The SO ran between the homes on Courtney Crescent and tackled the Complainant to the ground Within moments the SO had handcuffed the Complainant and taken him into custody There is conflict in the evidence regarding the Complainant’s location when he was first physically engaged by the SO Some evidence indicates that the Complainant had just placed a foot onto the fence when the SO first made contact with him The SO in evidence confirmed by other evidence says that the Complainant was already on the opposite side of the fence when he caught up with him and took him to the ground.\n,Based on information he had received upon being dispatched in relation to an assault in progress and what he gathered at the scene suggesting the perpetrator of the assault was fleeing police I am unable to reasonably conclude that the SO did not have a lawful basis for seeking to arrest the Complainant,https://www.siu.on.ca/en/directors_report_details.php?drid=1002
2020,OPP,,Ontario,The CW was fortunate to have escaped the collision without serious injury,Consequently there is no basis for proceeding with criminal charges against the officer and the file is closed,https://www.siu.on.ca/en/directors_report_details.php?drid=1021
2020,OPP,Brighton,Ontario,The Complainant was diagnosed as having suffered “a grade 3 acromioclavicular joint separation”,In the result as there are no reasonable grounds in the evidence to believe that the SO comported himself in breach of the criminal law there is no basis for proceeding with criminal charges and the file is closed,https://www.siu.on.ca/en/directors_report_details.php?drid=1311
2020,OPP,Englehart,Ontario,He was assessed by a doctor diagnosed with a concussion and prescribed pain medication,Accordingly there is no basis for proceeding with criminal charges in this case and the file is closed,https://www.siu.on.ca/en/directors_report_details.php?drid=1085
2020,Peel Regional Police,,Ontario,An ambulance eventually transported the Complainant to hospital where he was diagnosed with two right-sided rib fractures,Accordingly there is no basis for proceeding with criminal charges against the officer and the file is closed,https://www.siu.on.ca/en/directors_report_details.php?drid=1091
2020,Niagara Regional Police Service,Welland,Ontario,Following his arrest the Complainant was taken to hospital and treated for multiple facial lacerations and several rib fractures,Accordingly there is no basis for proceeding with criminal charges in this case and the file is closed,https://www.siu.on.ca/en/directors_report_details.php?drid=970
2020,Peel Regional Police,,Ontario,Choudry’s abdomen and his right elbow was fractured,Choudry amounted to legally unjustified force or was the culmination of a criminally negligent course of conduct there is no basis to proceed with criminal charges in this case notwithstanding Mr,https://www.siu.on.ca/en/directors_report_details.php?drid=1201
2020,Niagara Regional Police Service,Niagara,Ontario,The paramedics and officers attempted to coax the Complainant off the porch to be medically assessed but to no avail,Accordingly there is no basis for proceeding with criminal charges in this case and the file is closed,https://www.siu.on.ca/en/directors_report_details.php?drid=956
2020,Peel Regional Police,Toronto,Ontario,A pathologist with the Ontario Coroner’s Office in Toronto conducted the post-mortem examinations of Complainant 1 and two of the children,On my assessment of the evidence there are no reasonable grounds to believe that the SO committed a criminal offence in connection with the motor vehicle collision,https://www.siu.on.ca/en/directors_report_details.php?drid=964
2020,OPP,Bruce,Ontario,He has undergone multiple procedures to treat burn-related injuries,Accordingly there being no basis to proceed with criminal charges in this case the file is closed,https://www.siu.on.ca/en/directors_report_details.php?drid=1126
2020,Toronto Police Service,Markham,Ontario,Complainant 1 suffered a fractured hand while one of her daughters Complainant 2 broke her clavicle,In the result as there are no reasonable grounds on the aforementioned-record to believe that the SO transgressed the limits of care prescribed by the criminal law there is no basis for proceeding with criminal charges against the officer and the file is closed,https://www.siu.on.ca/en/directors_report_details.php?drid=1051
2020,Halton Regional Police Service,Brant,Ontario,The Complainant was taken from the scene to hospital where he was diagnosed and treated for a dislocated left hip and fractured left leg,Accordingly there is no basis for proceeding with criminal charges against the subject officer and the file is closed,https://www.siu.on.ca/en/directors_report_details.php?drid=1031
2020,Greater Sudbury Police Service,Bruce,Ontario,Later that morning after he was seen to have a swollen left hand the Complainant was taken to hospital and diagnosed with a fractured left hand,Accordingly there is no basis to proceed with criminal charges in this case and the file is closed,https://www.siu.on.ca/en/directors_report_details.php?drid=939
2020,Peel Regional Police,Mississauga,Ontario,While in the custody of the YRP the Complainant complained of chest pain and was taken to MHH where he was diagnosed with a rib fracture,Accordingly there is no basis for proceeding with criminal charges in this case and the file is closed,https://www.siu.on.ca/en/directors_report_details.php?drid=954
