Year,Police Service,City,Province,Civilian Consequences,Investigation Final Decision,Link
2019,Toronto Police Service,York,Ontario,n r\n The following scenario emerges from the weight of the reliable evidence collected by the SIU At about 10:30 p.m on June 24 2019 the TPS received a call from York University requesting assistance with an ongoing altercation outside of Vari Hall The parties involved in the dispute were the Complainant and the CW After speaking with campus security and gathering information the officers decided to arrest the Complainant for having assaulted the CW The Complainant was taken into custody and lodged in the backseat of SO 1 and WO 2’s cruiser for transport to the station Once at the station the Complainant was escorted into the booking room to be paraded prior to being placed in a cell Because the Complainant was thought to have used a knife in the assault a strip search was ordered by the staff sergeant At about 11:42 p.m the Complainant was escorted into a small search room in the CIB area by several officers The Complainant resisted the officers’ efforts to search him and a struggle ensued in the course of which the Complainant was taken to the ground The subject officers wrestled with the Complainant and were soon able to subdue him whereupon the search was completed The Complainant was led from the search room to a cell where he was lodged until his departure from the station the following morning.\n,Be that as it may as there is insufficient evidence to reasonably conclude that any of the subject officers acted other than lawfully in their dealings with the Complainant there is no basis to proceed with criminal charges in this case despite the possibility the Complainant was injured during the search at the police station perhaps during the takedown,https://www.siu.on.ca/en/directors_report_details.php?drid=809
2019,OPP,,Ontario,n r\n Thanks to a video recording of the incident captured by a Highway 407 camera the material events in question are largely clear despite neither subject officer providing the SIU a statement as was their legal right In the evening on September 12 2019 several calls were received by the OPP from motorists reporting the Complainant’s presence on the metal gantry across the Highway 407 eastbound exit ramp leading to Highway 410 SO 1 was the first to arrive at the scene at about 7:45 p.m With his cruiser’s emergency lights flashing SO 1 parked his cruiser in the area below the Complainant At 7:47 p.m two other OPP cruisers managed to stop traffic through the area by positioning their vehicles under the Kennedy Road South overpass SO 2 arrived on scene at about 7:47:26 p.m and parked beside SO 1’s cruiser The two officers emerged simultaneously from their vehicles They had each taken a number of steps closer to the Complainant when the Complainant fell approximately six metres from the gantry above landing in front of the officers SO 1 continued toward the Complainant as SO 2 returned to his cruiser to report what had happened Paramedics attended the scene and transported the Complainant to hospital where he received emergency care r\n\r\n,Accordingly there is no basis for proceeding with criminal charges in the case and the file is closed,https://www.siu.on.ca/en/directors_report_details.php?drid=652
2019,Peel Regional Police,Mississauga,Ontario,Following his arrest the Complainant was taken from the scene in an ambulance to hospital where he was diagnosed with a number of facial fractures,In the result as I am satisfied that the Complainant’s arrest and the force used in aid thereof were legally justified there is no basis to proceed with criminal charges in this case and the file is closed,https://www.siu.on.ca/en/directors_report_details.php?drid=648
2019,Kingston Police,Kingston,Ontario,The preliminary finding following the post-mortem examination of the Complainant concluded that the cause of death was stab wounds to the neck and a gunshot wound to the torso,Accordingly there is no basis for proceeding with charges in this case and the file is closed,https://www.siu.on.ca/en/directors_report_details.php?drid=775
2019,London Police Service,Windsor,Ontario,Two sources of evidence indicate that the police without provocation beat the Complainant causing his injury,Accordingly there is no basis to proceed with criminal charges against SO 1 and SO 3 or SO 2 and the file is closed,https://www.siu.on.ca/en/directors_report_details.php?drid=828
2019,Sarnia Police Service,Sarnia,Ontario,Emergency Medical Services was contacted and the Complainant was transported to hospital where he was diagnosed with having sustained a fractured right arm,In the result I have no reasonable grounds to believe that the SO either caused or contributed to the collision in question or otherwise drove dangerously in violation of the Criminal Code,https://www.siu.on.ca/en/directors_report_details.php?drid=757
2019,Peel Regional Police,Brampton,Ontario,The CEWs likely did not play a major role if any in his death,Accordingly even if the officers could be seen to have been criminally negligent there would still be no reasonable grounds to believe their conduct caused the Complainant’s death for purposes of laying charges,https://www.siu.on.ca/en/directors_report_details.php?drid=994
2019,Hamilton Police Service,Hamilton,Ontario,Upon arrival at the police station it was determined that the Complainant required medical assistance and he was transported to the hospital where he was diagnosed as having sustained a fractured hip,In the result as I am satisfied that the SO acted lawfully throughout his dealings with the Complainant there is no basis to proceed with criminal charges in this matter and the file is closed,https://www.siu.on.ca/en/directors_report_details.php?drid=713
2019,Peel Regional Police,,Ontario,r\n\nCause of Death nA post-mortem examination was conducted by a Forensic Pathologist who concluded that the cause of death was the result of “Multiple blunt force injuries,Accordingly there is no basis for proceeding with criminal charges in this case and the file is closed,https://www.siu.on.ca/en/directors_report_details.php?drid=731
2019,Windsor Police Service,McDougall,Ontario,Paramedics arrived at the scene and took the Complainant to hospital where his head injury was diagnosed,Accordingly there is no basis for proceeding with charges in this case and the file is closed,https://www.siu.on.ca/en/directors_report_details.php?drid=588
2019,Toronto Police Service,Toronto,Ontario,n r\n The material events in question emerge clearly on the evidence collected by the SIU which included interviews with the Complainant four civilian witnesses the SO and one witness officer The investigation also benefitted significantly from AVL/GPS data and the in-car ICCS footage from the SO’s police vehicle as well as a record of the communications from the relevant time frame and CCTV footage from various sources in the area of the incident On August 26 2019 at 4:21:16 1 p.m the SO was stationary in his police vehicle on Coxwell Avenue just south of Upper Gerrard Street in Toronto when a Chevrolet Equinox came to his attention The SO observed the Equinox speed off from the curb very quickly spinning its tires and then heading in the direction the SO was parked As the SO continued to observe the motor vehicle it made an un-signaled lane change The SO formed the grounds to believe that the vehicle was being operated carelessly in contravention of the Highway Traffic Act HTA and decided to stop it and investigate The SO followed the Equinox onto Fairford Avenue and activated his emergency lighting system in order to signal to the driver of the Equinox to pull over and stop which he then did Once stopped the SO entered his location into his in-car computer along with the fact that he was conducting a vehicle stop exited his cruiser and approached the Equinox As the SO neared the driver’s door the driver suddenly sped off westbound on Fairford Avenue The SO ran back to his vehicle and began to follow the Equinox in order to alert other police vehicles in the area of the location of the Equinox in hopes that they might be able to conduct a vehicle stop The SO also notified his dispatcher that a vehicle had just taken off on him and continuously updated the dispatcher as to the vehicle’s location and what was happening as events unfolded 2 The Equinox was travelling at that point at speeds ranging from 60 – 70 km/h 3 in a 50 km/h zone and was approximately 90 metres 4 ahead of the SO’s police vehicle The SO while travelling on Fairford Avenue at no time exceeded a speed of 19 km/h resulting in the distance between himself and the Equinox increasing The driver of the Equinox made a left turn onto Woodfield Road where he struck a parked car The driver then sped toward Gerrard Street East in a posted 40 km/h zone His estimated speed was between 60 to 70 km/h while the SO’s police vehicle was described as having its emergency lighting system activated but no siren The data from the SO’s cruiser confirmed that he maintained a speed of 25 km/h while on Woodfield Road At the intersection of Woodfield Road and Gerrard Street East the driver failed to stop for the stop sign unlawfully entering the intersection and colliding with the Complainant’s Honda Civic which was travelling westbound on Gerrard Street East At the time of the collision the SO’s police vehicle was more than 150 metres away on Woodfield Road and 14 seconds behind the Equinox 5 n,In the final analysis in the context of the SO’s very brief engagement in time and distance with the Equinox notable for the officer’s careful driving throughout there is no basis for proceeding with criminal charges and the file is closed,https://www.siu.on.ca/en/directors_report_details.php?drid=725
2019,Toronto Police Service,Toronto,Ontario,Once at hospital x-rays revealed that the Complainant had a fractured jaw,Accordingly there is no basis for proceeding with charges in this case and the file is closed,https://www.siu.on.ca/en/directors_report_details.php?drid=773
2019,Peel Regional Police,,Ontario,n\nCause of Death nThe pathologist who performed the post-mortem examination of the Complainant determined the cause of death to be a gunshot wound to the head,Accordingly there is no basis for proceeding with charges in this case and the file is closed,https://www.siu.on.ca/en/directors_report_details.php?drid=783
2019,Niagara Regional Police Service,Lincoln,Ontario,The SIU’s investigation into the circumstances surrounding the Complainant’s injuries consisted of interviews with the Complainant the SO and the WO,Accordingly there is no basis for proceeding with charges in this case and the file is closed,https://www.siu.on.ca/en/directors_report_details.php?drid=707
2019,OPP,Huntsville,Ontario,The SIU’s investigation into the circumstances surrounding the serious injury sustained by Complainant 1 included interviews with Complainant 1 Complainant 2 and WO 1,Accordingly there is no basis for proceeding with criminal charges in this case and the file is closed,https://www.siu.on.ca/en/directors_report_details.php?drid=703
2019,North Bay Police Service,,Ontario,The Complainant was diagnosed with a broken left hip and right leg,Accordingly there is no basis for proceeding with criminal charges in this case and the file is closed,https://www.siu.on.ca/en/directors_report_details.php?drid=697
2019,OPP,Caledon,Ontario,n r\n On March 1 2019 officers from the Caledon Detachment of the OPP responded to a 911 call requesting police assistance OPP officers responded to the residence and arrested and handcuffed the Complainant following which they transported him to the Nottawasaga Detachment of the OPP The Complainant later filed a complaint with the OIPRD reporting that when he was arrested the police officers banged his head on the ground and caused a brain bleed It was further alleged that because the police officers had not double-locked his handcuffs the cuffs tightened on his wrists resulting in broken bones in his hands.\n,Accordingly there are no reasonable grounds to believe that the SO or any police officer involved in the Complainant’s arrest or imprisonment assaulted him causing any injury and the file is closed,https://www.siu.on.ca/en/directors_report_details.php?drid=650
2019,Ottawa Police Service,Ottawa,Ontario,During the course of his arrest the Complainant sustained an injury which was later identified as a fracture of the orbital bone,For the foregoing reasons there is no basis for proceeding with criminal charges against any of the officers involved in the Complainant’s arrest and the file is closed,https://www.siu.on.ca/en/directors_report_details.php?drid=787
2019,Toronto Police Service,,Ontario,An ambulance was called to the scene and the Complainant was taken to hospital where his injuries were diagnosed,Be that as it may as I am satisfied that the SO acted reasonably in striking the Complainant in self-defence and to maintain lawful control over him while in custody there is no basis for proceeding with charges in this case,https://www.siu.on.ca/en/directors_report_details.php?drid=803
2019,Barrie Police Service,Barrie,Ontario,The takedown resulted in the Complainant’s fractured left arm,In conclusion as there are no reasonable grounds to believe in my view that the Complainant’s arrest was unlawful or that his injury was the result of excessive force there is no basis for proceeding with criminal charges against the SO,https://www.siu.on.ca/en/directors_report_details.php?drid=584
2019,Niagara Regional Police Service,Hamilton,Ontario, the forensic pathologist declared the post-mortem examination complete indicating the cause of death of the Complainant as “Multiple blunt force injuries of the head and torso,In conclusion as there is no reason to suspect that the SO drove his cruiser other than responsibly with due care and regard for traffic around him including the Complainant there is no basis to proceed with criminal charges in this case and the file is closed,https://www.siu.on.ca/en/directors_report_details.php?drid=693
2019,York Regional Police,Markham,Ontario,After the Complainant was subdued both the Complainant and the SO were taken to hospital where the Complainant was diagnosed with a non-displaced fracture of his right nasal bone and the SO received a Hepatitis C shot along with medication for the bite on his thigh,This level of force falls within the scope of that permitted by law and I am accordingly unable to form reasonable grounds to believe that either the SO or the WO committed a criminal offence in connection with the Complainant’s injury,https://www.siu.on.ca/en/directors_report_details.php?drid=687
2019,York Regional Police,,Ontario,CW 1 did not suffer any serious injuries as a result of the incident,On my assessment of the evidence I am satisfied there are no reasonable grounds to believe that the SO committed a criminal offence in connection with the Complainant’s arrest and injuries,https://www.siu.on.ca/en/directors_report_details.php?drid=610
2019,OPP,,Ontario,n r\n The material facts in question are clear on the weight of the evidence gathered by the SIU which included interviews with both the Complainant and the CW While the SO declined to be interviewed by SIU investigators as was his legal right the investigation was critically aided by the availability of camera footage from three CCTV cameras as well as the crash data from the pickup truck operated by the CW and the GPS data from the SO’s police vehicle At approximately 3:55 a.m the CW pulled into a gas station to fuel the vehicle he was driving while he was doing so the SO pulled up to a gas pump in his police vehicle and also began to fuel his vehicle The CW appeared to attract the SO’s attention when he pulled the pickup truck to the rear of the gas station with no taillights activated in order to wait for the woman to exit the kiosk after paying When the CW drove out of the gas station the SO is seen on camera to be watching the direction of the vehicle’s travel and after he completed fueling his vehicle he followed in his cruiser The CW drove eastbound on Fanshawe Park Road West and then accelerated down a side street Louise Boulevard Due to his high rate of speed when the CW reached the south end of the street where there was a sudden dark turn to the west his vehicle collided with a tree The data from the SO’s police cruiser confirmed that at no time did he engage his emergency equipment and there is some evidence suggesting that the Complainant was not even aware they were being followed by police during the incident Nobody attributed the collision to the SO Upon analysis of the CCTV footage it was discovered that while on Fanshawe Park Road West the Ford F150 attained a speed of 124.3 km/h while the SO’s police vehicle attained a speed of 118.9 km/h the police vehicle was clocked as being nine seconds behind the Ford F150 Analysis of the footage from a second CCTV camera on Louise Boulevard revealed sounds of a vehicle quickly accelerating followed by the appearance of the F150 which is both seen and heard to be aggressively accelerating The footage then reveals a second vehicle the SO’s cruiser approaching and turning onto Louise Boulevard there is no squealing of tires heard from this second vehicle This video confirms that the SO’s police vehicle was at that point 16 seconds behind the pickup truck no lights or sirens are seen or heard n the video from the police vehicle The video footage from all three CCTV cameras indicated that there were no other motor vehicles either in the gas station or on the roads The GPS data from the SO’s cruiser has the SO attaining a top speed of 138 km/h when driving eastbound on Fanshawe Park Road West near Derwent Road as he approached Louise Boulevard his speed decreased to 128 km/h Once on Louise Boulevard at 31 km north of the collision scene where according to the video the F150 pickup truck was no longer visible the SO pulled his vehicle over and stopped n,Consequently there is no basis for proceeding with charges in this case and the file is closed,https://www.siu.on.ca/en/directors_report_details.php?drid=681
2019,Toronto Police Service,Toronto,Ontario,An ambulance was called and transported the Complainant to hospital where he was diagnosed with a fractured jaw,Accordingly there is no basis for proceeding with charges in this case and the file is closed,https://www.siu.on.ca/en/directors_report_details.php?drid=674
2019,Toronto Police Service,Toronto,Ontario,Fractures to one of his hands and wrists were also apparent but it was unclear whether these were old injuries that were aggravated in the altercation or new fractures,Accordingly there is no basis for proceeding with criminal charges in this case and the file is closed,https://www.siu.on.ca/en/directors_report_details.php?drid=818
2019,London Police Service,,Ontario,Once at hospital the Complainant was diagnosed with having sustained a fractured metacarpal and a plaster cast was applied,In the final analysis whether the SO caused or contributed to the Complainant’s injury and it appears unlikely he did either there is no basis in my view to believe that the officer acted other than lawfully in his dealings with the Complainant,https://www.siu.on.ca/en/directors_report_details.php?drid=747
2019,Windsor Police Service,,Ontario,He was subsequently transported to hospital where he was diagnosed with a fractured left finger,In the result as there are no reasonable grounds to believe that the SO and the WO acted other than lawfully in effecting the Complainant’s arrest there is no basis for proceeding with charges in this case and the file is closed,https://www.siu.on.ca/en/directors_report_details.php?drid=700
2019,Toronto Police Service,Toronto,Ontario,Following his arrest the Complainant complained that he may have suffered a stroke or a heart attack and he was transported to hospital where it was discovered that he had fractured his right femur,This level of force falls within the scope of that permitted by law and I am accordingly unable to form reasonable grounds to believe that the SO or any police officer assisting in the Complainant’s arrest committed a criminal offence in connection with the Complainant’s injuries,https://www.siu.on.ca/en/directors_report_details.php?drid=685
2019,,,Ontario,r\n\nCause of Death The pathologist at autopsy concluded that the Complainant’s death was attributable to “sudden cardiorespiratory arrest in a man with acute methamphetamine toxicity excited delirium and physical restraints”,In conclusion as there are no reasonable grounds to believe that WO 1 and the SO committed the criminal offence of criminal negligence causing death there is no basis for proceeding with criminal charges in this case,https://www.siu.on.ca/en/directors_report_details.php?drid=1271
2019,Belleville Police Service,Belleville,Ontario,n r\n The material events in question are clear on the evidence collected by the SIU which included statements from the Complainant and the SO At about 1:10 a.m of August 6 2019 the BPS received a 911 call from a woman expressing concern about the welfare of her daughter Her daughter had contacted her to say that the Complainant the woman’s partner was drunk and abusive and would not let her leave the residence with her children Police officers were dispatched to the home of the woman’s daughter in Belleville r\n The SO WO 1 and WO 2 arrived at the residence and were let inside by the Complainant’s spouse While the Complainant had not assaulted or threatened her she told the officers that she was concerned for her safety and the safety of her children given the Complainant’s state of intoxication and belligerence The Complainant’s spouse explained that she wanted the Complainant to leave the residence or assistance by the officers in facilitating her own departure with her children As the children were sleeping the officers decided to pursue the first option as the most practical in the circumstances.\n The SO WO 1 and WO 2 proceeded to the second floor to speak with the Complainant in his bedroom The Complainant was upset that his spouse had contacted the police but did agree to leave the home and stay with an acquaintance He was escorted down the stairs and out through the front door The officers offered the Complainant a ride to his friend’s place When the Complainant declined the offer and refused to indicate where he would be going the officers grew worried that he would return to the home and resume his behaviour with his spouse.\n The Complainant re-entered the home to gather some clothing and continued to berate his spouse as he did so Once out the front door again the SO informed him that he was under arrest and took hold of his left arm The Complainant pulled his arm away from the officer and fell off the small porch in front of the door He landed on his right side on a section of grass with the SO falling on top of him With the assistance of WO 1 and WO 2 the Complainant was quickly handcuffed on the ground.\n Following his arrest the Complainant was transported to the station and lodged in a cell He subsequently complained of pain in his right arm and was taken to hospital n,Accordingly there is no basis to proceed with criminal charges in this case and the file is closed,https://www.siu.on.ca/en/directors_report_details.php?drid=632
2019,London Police Service,London,Ontario,The Complainant was taken to hospital where he was treated for his burns,In the final analysis as I am satisfied that the officers acted lawfully throughout their dealings with the Complainant there is no basis for proceeding with charges in this case and the file is closed,https://www.siu.on.ca/en/directors_report_details.php?drid=666
2019,Brantford Police Service,Brantford,Ontario,The Complainant sustained multiple gunshot wounds resulting in severe injuries,Accordingly as there is no basis to form reasonable grounds to believe that a criminal offence has been committed by either police officer no charges will issue and this file is closed,https://www.siu.on.ca/en/directors_report_details.php?drid=727
2019,OPP,Collingwood,Ontario,He was transported to the hospital and diagnosed with a broken nose,In the circumstances I am satisfied on reasonable grounds that the Complainant’s arrest was lawful under section 31(5 of the LLA,https://www.siu.on.ca/en/directors_report_details.php?drid=705
2019,Peel Regional Police,Mississauga,Ontario,She was taken from the scene to hospital and treated for a dog bite injury,In my view on this record there are no reasonable grounds to believe the SO was criminally negligent in his use of the dog,https://www.siu.on.ca/en/directors_report_details.php?drid=709
2019,OPP,Barrie,Ontario,The cause of death was determined as “a gunshot wound to torso,In the result there is no basis for proceeding with criminal charges in this case and the file is closed,https://www.siu.on.ca/en/directors_report_details.php?drid=826
2019,Kingston Police,,Ontario,Furthermore based on the interval of time with stable vital signs between the deployment of the CEW and death the CEW deployment was not considered to be a factor contributing to the death according to the pathologist,On this record I am satisfied that there are no reasonable grounds to believe that the subject officers conducted themselves other than lawfully in their encounter with the Complainant and conclude there is no basis for proceeding with criminal charges in this case,https://www.siu.on.ca/en/directors_report_details.php?drid=966
